{
  "artifact": "CANON/shelf-count-v1.0.0.md",
  "artifact_id": "artifact.shelf-count.v1_0_0",
  "artifact_sha256": "89e74f90e9800f132e9189ad5cf4abf7d4e046eb802da2a92aa2647809c07ac5",
  "candidate": "RECEIPTS/candidates/shelf-count-v1.0.0.md",
  "candidate_sha256": "89e74f90e9800f132e9189ad5cf4abf7d4e046eb802da2a92aa2647809c07ac5",
  "decision_by": "cedar-lane-coordinator",
  "evidence": [
    "RECEIPTS/evidence/shelf-count-v1.json"
  ],
  "evidence_sha256": {
    "RECEIPTS/evidence/shelf-count-v1.json": "dad6db09baded589b88688abe7c9a43d03f975b7e6065c1070ed3ddfec996ab2"
  },
  "promoted_from": "working",
  "promoted_utc": "2026-07-12T09:40:00Z",
  "promotion_id": "promotion.shelf-count.v2",
  "reviews": [
    "RECEIPTS/reviews/independent-review-v2.json"
  ],
  "reviews_sha256": {
    "RECEIPTS/reviews/independent-review-v2.json": "c789365f0eada2124667a06db83fc7644397e43c804ad0a395a27e3c78de92d7"
  },
  "schema": "bvm-promotion/0.1"
}
